{
  "test_execution": {
    "test_case_id": "E2E-SALES-DASHBOARD-APP-001",
    "test_version": "2.0",
    "agent_type": "AWS Bedrock Harness AgentCore Browser UI",
    "executed_at": "2026-06-13T17:46:33.158604Z",
    "region": "us-east-1",
    "account": "QuickSight-Workshop-<WORKSHOP_ACCOUNT_ID>-us-east-1-1781365531",
    "overall_status": "PARTIAL",
    "counts": {
      "total_steps": 21,
      "passed": 12,
      "partial": 6,
      "failed": 1,
      "blocked": 0,
      "skipped": 2
    },
    "summary": "Phase 1 (REST connector) built & published; connector actions are auto-generated and NOT customizable (PARTIAL). Phase 2 app built entirely via the App editor AI assistant in one prompt (table+chart+AI summary). Consent is a per-asset checkbox 'Confirm use of assets' dialog plus a runtime 'Allow one time / Allow on this app' permission. Phase 3 preview renders in a cross-origin sandboxed iframe (title 'Sandbox Error') that automation cannot read -> PARTIAL, human visual check needed. Phase 4 publish succeeded; sharing with an external email FAILED because the share search returns 'No results found' for non-directory users and the Share button stays disabled."
  },
  "cookbook_corrections": [
    {
      "step_id": "1.1",
      "cookbook_says": "Connectors page at /sn/quicksight-connectors",
      "actual_ui": "That path returns 'Not Found'. Real path: https://us-east-1.quicksight.aws.amazon.com/sn/account/QuickSight-Workshop-<WORKSHOP_ACCOUNT_ID>-us-east-1-1781365531/start/integrations?tab=action , reached via left sidebar item 'Connectors'.",
      "correction_needed": true,
      "suggested_correction": "Update Connectors URL to /sn/account/{account}/start/integrations?tab=action and note it is opened from the 'Connectors' sidebar item."
    },
    {
      "step_id": "1.2",
      "cookbook_says": "Click 'Create connector' button",
      "actual_ui": "No generic 'Create connector' button. You pick a connector-type card ('REST API connection') from the 'Available' tab catalog, which opens a dialog titled 'REST API connection details' with wizard steps Connect / Review / Publish.",
      "correction_needed": true,
      "suggested_correction": "Replace 'Create connector' with: select the 'REST API connection' card under the 'Available' tab; wizard = Connect / Review / Publish."
    },
    {
      "step_id": "1.3",
      "cookbook_says": "Fields: API endpoint / Server URL; auth dropdown",
      "actual_ui": "Field labels are: Name ('Enter name'), '+ Add Description', 'Connection type' (Public network), 'OAuth Configuration' (options: Custom OAuth app | Service-to-Service OAuth | None), 'Base URL' (placeholder https://mydomain.com). Buttons Cancel / Next.",
      "correction_needed": true,
      "suggested_correction": "Use exact labels 'Base URL' and 'OAuth Configuration'; for no-auth choose 'None'."
    },
    {
      "step_id": "1.4",
      "cookbook_says": "Define a 'GetProducts' GET /products read action (name, method, path, type)",
      "actual_ui": "The Review step ('Review actions for REST API connection') AUTO-lists fixed actions Delete/Get/Patch/Post/Put with columns Action/Type/Description. There is NO add-action button and NO per-action name/path/operation-type fields. A custom 'GetProducts GET /products' action cannot be defined here.",
      "correction_needed": true,
      "suggested_correction": "Remove the manual 'GetProducts' action steps. Document that REST connector actions are auto-generated HTTP-method actions (Get/Post/Put/Patch/Delete) and are not individually configurable in this wizard."
    },
    {
      "step_id": "1.5",
      "cookbook_says": "Save + Test the connector",
      "actual_ui": "Final step is 'Publish connection for REST API connection' with access options 'Everyone in your organization' / 'Specific groups'; button 'Publish'. No explicit 'Test' button in the wizard. After publish the connector appears under 'Connected' with desc 'Connect to any REST API endpoint with standard HTTP methods.'",
      "correction_needed": true,
      "suggested_correction": "Rename 'Save+Test' to 'Publish'; note access scope selection and that there is no test step in the wizard."
    },
    {
      "step_id": "2.1",
      "cookbook_says": "Apps page at /sn/apps; click Create app and fill a creation dialog",
      "actual_ui": "App editor opens at /sn/account/{account}/apps/{app-id}/edit. App starts as 'Untitled App' and is auto-renamed from the build prompt (became 'Sales Dashboard'). The build is driven by the in-editor 'APPS ASSISTANT' chat, input placeholder 'Ask Apps to make changes', submitted with Enter (Send button also present).",
      "correction_needed": true,
      "suggested_correction": "Document that the app is created as 'Untitled App', auto-named from the AI prompt, and built via the APPS ASSISTANT chat (placeholder 'Ask Apps to make changes', submit with Enter)."
    },
    {
      "step_id": "2.2",
      "cookbook_says": "A connector consent dialog with Allow/Deny",
      "actual_ui": "Consent is an inline 'Confirm use of assets' block listing each asset (e.g. 'AI Inference - Read-only access', 'Sales API Connector - Read/Write') EACH with its own checkbox (button role=checkbox, aria-checked). Buttons: 'Deny all' / 'Confirm'. Clicking 'Confirm' only approves assets whose checkbox is checked; an unchecked asset is reported as DENIED.",
      "correction_needed": true,
      "suggested_correction": "Document title 'Confirm use of assets', per-asset checkboxes (must be checked to grant), access labels 'Read-only access'/'Read/Write', and buttons 'Deny all'/'Confirm'. Warn that 'Confirm' with an unchecked asset = denied."
    },
    {
      "step_id": "3.0",
      "cookbook_says": "Runtime connector/AI consent is the same as build consent",
      "actual_ui": "A second, distinct runtime permission dialog appears with radio options 'Allow one time' (Permission is used once and then removed) and 'Allow on this app' (Permission persists until you revoke it); buttons 'Do not allow' / 'Continue'.",
      "correction_needed": true,
      "suggested_correction": "Add a separate runtime-permission dialog: options 'Allow one time' / 'Allow on this app', buttons 'Do not allow' / 'Continue'."
    },
    {
      "step_id": "3.1",
      "cookbook_says": "Preview renders inline and is inspectable",
      "actual_ui": "Preview renders in a cross-origin sandboxed iframe (srcdoc, sandbox='allow-scripts allow-modals', title 'Sandbox Error'). Automation cannot read its DOM, so table/chart/AI rendering must be verified visually by a human.",
      "correction_needed": true,
      "suggested_correction": "Note that the preview/published app runs in a sandboxed iframe; programmatic verification of rendered content is not possible and visual inspection is required."
    },
    {
      "step_id": "4.1",
      "cookbook_says": "Publish via a Publish button; success toast",
      "actual_ui": "'Publish' button opens dialog 'Publish your app' (shows a 'Changes' summary; buttons Cancel/Publish). On success a dialog 'Your app has been published' shows App name, the view URL (.../apps/{id}/view/app) and buttons 'Dismiss'/'Open'. App status changes Private -> Published.",
      "correction_needed": true,
      "suggested_correction": "Document the publish confirmation dialog ('Publish your app') and the success dialog ('Your app has been published') with the /view/app URL and Dismiss/Open buttons."
    },
    {
      "step_id": "4.4",
      "cookbook_says": "Share with an external email (pilot-user@example.com) as Viewer",
      "actual_ui": "Share dialog 'Share this app' has search placeholder 'Search for name, alias or email', permission levels 'Viewer' and 'Co-owner', a 'Share' button, a 'Shared with' list, a 'Share with all' option ('Everyone in this account can use this app') and 'Copy link'. Typing the external Gmail returns 'No results found' and the 'Share' button stays DISABLED \u2014 you cannot invite a non-directory email. Viable sharing = existing directory users, 'Share with all', or 'Copy link'.",
      "correction_needed": true,
      "suggested_correction": "Remove the external-email share step; document that direct share requires an existing directory user. Permission levels are 'Viewer'/'Co-owner'. For external/broad sharing use 'Copy link' or 'Share with all'."
    }
  ],
  "ui_discovery": {
    "connector_page": {
      "url_path": "/sn/account/{account}/start/integrations?tab=action",
      "sidebar_menu_text": "Connectors",
      "page_heading": "Connectors",
      "page_subtitle": "Connect Quick to other applications",
      "tabs": [
        "Available",
        "Create for your team"
      ],
      "create_button_text": "(no generic create button \u2014 select the 'REST API connection' connector-type card)",
      "connector_types_available": [
        "REST API connection"
      ],
      "creation_dialog_title": "REST API connection details",
      "wizard_steps": [
        "Connect",
        "Review",
        "Publish"
      ],
      "form_fields": {
        "name_label": "Name (placeholder 'Enter name')",
        "description_label": "+ Add Description",
        "connection_type_label": "Connection type (option: Public network)",
        "url_label": "Base URL (placeholder https://mydomain.com)",
        "auth_label": "OAuth Configuration",
        "auth_options": [
          "Custom OAuth app",
          "Service-to-Service OAuth",
          "None"
        ]
      },
      "action_form_fields": {
        "note": "Actions are AUTO-generated and NOT user-configurable.",
        "review_step_heading": "Review actions for REST API connection",
        "columns": [
          "Action",
          "Type",
          "Description"
        ],
        "auto_actions": [
          "Delete",
          "Get",
          "Patch",
          "Post",
          "Put"
        ],
        "name_label": null,
        "method_label": null,
        "method_options": [],